{
  "agents": [
    {
      "id": "agent.procurement-1",
      "type": "software-agent",
      "name": "Procurement Review Agent",
      "roles": [
        {
          "id": "role.delegate",
          "type": "delegate"
        }
      ]
    },
    {
      "id": "agent.attention-gateway-1",
      "type": "software-agent",
      "name": "Supplier Signal Gatekeeper",
      "roles": [
        {
          "id": "role.gateway",
          "type": "attention-gateway"
        }
      ]
    }
  ],
  "delegations": [
    {
      "id": "del.1",
      "delegatorRef": "org.acme",
      "delegateRef": "agent.procurement-1",
      "scope": "prepare supplier risk summary",
      "obligations": [
        "route high-risk suppliers to human review"
      ],
      "revocationStatus": "active"
    }
  ],
  "capabilities": [
    {
      "id": "cap.read-supplier-record",
      "name": "Read supplier record",
      "riskTier": "moderate"
    }
  ],
  "resources": [
    {
      "id": "res.supplier-db",
      "type": "supplier-database",
      "sensitivity": "confidential"
    }
  ],
  "executionContexts": [
    {
      "id": "ctx.1",
      "environment": "production",
      "userPresence": "not-present",
      "approvalState": "required",
      "riskTier": "high"
    }
  ],
  "actions": [
    {
      "id": "act.1",
      "actorRef": "agent.procurement-1",
      "type": "generate-risk-summary",
      "contextRef": "ctx.1",
      "capabilityRef": "cap.read-supplier-record",
      "resourceRef": "res.supplier-db",
      "oversightMode": "approval-gated"
    }
  ],
  "traceRecords": [
    {
      "id": "trace.1",
      "actionRef": "act.1",
      "output": "draft supplier risk summary",
      "effectRef": "eff.review-route"
    }
  ],
  "agentClasses": [
    {
      "id": "aclass.1",
      "agentRef": "agent.procurement-1",
      "classType": "execution",
      "controlMode": "human-on-loop",
      "representationScope": "prepare bounded procurement summaries under review"
    },
    {
      "id": "aclass.2",
      "agentRef": "agent.attention-gateway-1",
      "classType": "attention-gateway",
      "controlMode": "sidecar",
      "representationScope": "filter and route inbound supplier signals before escalation"
    }
  ],
  "attentionPolicies": [
    {
      "id": "apol.1",
      "agentRef": "agent.attention-gateway-1",
      "deliveryMode": "summarize",
      "interruptionBudget": "only escalate high-risk supplier events during review windows",
      "escalationRule": "immediately reroute sanctions or fraud indicators to human review",
      "signalSource": "supplier-alert-feed"
    }
  ]
}
